ID;Sentence;A.1);B.1);C.1);D.1);E.1);E.2);F.1);F.2);G.1);I.1);I.2);L.1);L.2);M.1);M.2);M.3);M.4);N.1);O.1);O.2);P.1)
967;L’accessibilità della scuola a tutti e quindi in particolare alle fasce deboli, ai diversamente abili, agli studenti stranieri;0;0;0;0;0;0;0;0;0;0;1;0;0;0;0;0;0;0;0;0;0
968;Creazione di luoghi di apprendimento favorevoli;0;0;0;0;0;0;1;0;0;0;0;0;0;0;0;0;0;0;0;0;0
969;L’opportunità di rendere la scuola accogliente e sicura per tutti;0;0;0;0;0;0;1;0;0;0;0;0;0;0;0;0;0;0;0;0;0
970;Lo spazio, inteso come insegnante aggiunto, diventa così un grande contenitore con un importante carattere educativo;0;0;0;0;0;0;0;0;0;0;0;1;0;0;0;0;0;0;0;0;0
971;Lo spazio, infatti, deve catturare l’interesse del bambino, offrendo occasioni di apprendimento e formazione personale culturale;0;0;0;0;0;0;0;0;0;0;0;1;0;0;0;0;0;0;0;0;0
972;Lo spazio, inteso come valore pedagogico fondamentale, diventa necessario per realizzare esperienze educative attraverso il fare e il pensare quotidiano;0;0;0;0;0;0;0;0;0;0;0;1;0;0;0;0;0;0;0;0;0
973;Favorire il dialogo tra pedagogia e architettura;0;0;0;0;0;0;0;0;0;0;0;1;0;0;0;0;0;0;0;0;0
974;L’ideazione a l’organizzazione degli spazi della scuola infanzia dovranno esprimere la cura ed il rispetto dei bisogni di esplorazione spaziale, cognitiva ed emotiva del bambino;0;0;0;0;0;0;1;0;0;0;0;1;0;0;0;0;0;0;0;0;0
975;Gli spazi che si prendono cura del bambino devono offrire l’opportunità di poter passare dalla sfera sociale collettiva a quella privata individuale;0;0;0;0;0;0;0;0;0;0;0;0;0;0;0;0;0;0;1;0;0
976;Si tratta di individuare spazi poli dimensionali;0;0;0;0;0;0;0;0;0;0;0;0;0;0;0;0;0;0;1;0;0
977;Spazi fruibili e accessibili, il bambino deve poter essere libero di scegliere gli spazi e utilizzarli come preferisce;0;0;0;0;0;0;0;0;0;0;0;1;0;0;0;0;0;0;0;0;0
978;Il loro spazio va configurato in modo da stimolare la ricerca e l’immaginazione, e quindi deve essere reattivo nei loro confronti, deve poter cambiare secondo le loro esigenze, deve essere stimolante ma allo stesso tempo rassicurante;0;0;0;0;0;0;1;0;0;0;0;0;0;0;0;0;0;0;1;0;0
979;Gli spazi scolastici della nuova scuola saranno caratterizzati dalla multimedialità, mediante l’inserimento di nuove tecnologie per le attività didattiche;0;0;0;0;0;0;0;0;0;0;0;1;0;0;0;0;0;0;0;0;1
980;Parte da qui la necessità di integrare la didattica con attività di insegnamento apprendimento in un ambiente caratterizzato dalla presenza di più tecnologie didattiche che vanno dal personal computer alla multimedialità;0;0;0;0;0;0;0;0;0;0;0;1;0;0;0;0;0;0;0;0;1
981;La nuova scuola dell’infanzia dovrà essere, pertanto, dotata di tutte quelle tecnologie e accorgimenti informatici necessari a supportare le attività didattiche multimediali, individuate nel piano pedagogico;0;0;0;0;0;0;0;0;0;0;0;0;0;0;0;0;0;0;0;0;1
982;Il nuovo edificio è da intendersi come elemento catalizzatore di un futuro sviluppo urbano della zona, nell’ambito di un piano di riqualificazione e rinnovamento dell’area;0;0;0;1;0;0;0;0;0;0;0;0;0;0;0;0;0;0;0;0;0
983;In quest’ottica la nuova scuola infanzia dovrà essere il punto di partenza di un dialogo con l’intorno sia esso esistente o di futura costruzione, con cui condividere o ampliare questo spazio pubblico in futuro;1;0;0;0;0;0;0;0;0;0;0;0;0;0;0;0;0;0;0;0;0
984;Le strategie progettuali dovranno dare lettura dell'edificio come una parte di città, dove le decisioni progettuali hanno conseguenze tanto sul comfort degli utenti dell'edificio, quanto sul benessere dei cittadini;0;0;0;1;0;0;0;0;0;0;0;0;0;0;0;0;0;0;0;0;0
985;La nuova sagoma dell’edificio, inteso come conformazione plano volumetrica della costruzione ed il suo perimetro considerato in senso verticale ed orizzontale, dovrà tener conto dell’area di sedime e del contesto urbano in cui sarà inserito, considerando la protezione e il ripristino dell’habitat e la massimizzazione degli spazi aperti mirata alla conservazione delle aree naturali;0;0;0;1;0;0;0;0;0;0;0;0;0;0;1;0;0;0;0;0;0
986;La massimizzazione degli spazi aperti ha come finalità di fornire un’elevata quantità di spazio aperto sistemato a verde in rapporto all’ impronta del nuovo edificio, in modo tale da promuovere la biodiversità;0;0;0;0;0;1;0;0;0;0;0;0;0;0;1;0;0;0;0;0;0
987;Tali servizi, in seguito alla realizzazione della nuova scuola, saranno implementati al fine di promuovere l’utilizzo dei trasporti alternativi e ridurre l’uso di veicoli privati, nonché l’inquinamento da traffico automobilistico;0;0;0;0;0;0;0;0;0;1;0;0;0;0;0;0;0;0;0;0;0
988;Le scelte progettuali dovranno avere lo scopo di promuove la riduzione dell’inquinamento luminoso e dei consumi energetici da esso derivanti, al fine di conservare e proteggere l’ambiente naturale;0;0;0;0;0;0;0;0;0;0;0;0;0;0;1;0;0;0;0;0;0
989;Il nuovo impianto di illuminazione esterna ed interna del nuovo edificio scolastico deve essere eseguito nel rispetto dei criteri di riduzione dell’inquinamento luminoso e di risparmio energetico;0;0;0;0;0;0;0;0;0;0;0;0;0;0;1;0;0;0;0;0;0
990;Ogni fenomeno di illuminazione molesta o di abbagliamento deve essere limitato;0;0;0;0;0;0;0;0;0;0;0;0;0;0;1;0;0;0;0;0;0
991;Le scelte progettuali adottate dovranno considerare anche di ridurre il cosiddetto effetto isola di calore, per minimizzare l’impatto sul microclima e sull’habitat umano e animale;0;0;0;0;0;0;0;0;0;0;0;0;0;0;1;0;0;0;0;0;0
992;Gli spazi esterni attrezzati a verde hanno un ruolo fondamentale nelle scelte progettuali della nuova scuola;0;0;0;0;0;1;0;0;0;0;0;0;0;0;0;0;0;0;0;0;0
993;L’applicazione dei materiali riflettenti sulle superfici dell’edificio e sulle superfici pavimentate contribuiscono in modo significativo ad aumentare l’albedo coefficiente di riflessione della città e diminuire di conseguenza le temperature superficiali, mitigando l’isola di calore urbana;0;0;0;0;0;0;0;0;0;0;0;0;0;0;1;0;0;0;0;0;0
994;Necessaria la pianificazione dei trasporti pubblici alternativi all’utilizzo dei veicoli privati e anche la pianificazione per una gestione controllata degli impianti dell’edificio, al fine di mitigare le temperature urbane e di minimizzare l’impatto sul microclima;0;0;0;0;0;0;0;0;0;1;0;0;0;0;1;0;0;0;0;0;0
995;Le scelte progettuali devono prevedere il controllo delle quantità delle acque meteoriche, al fine di limitare le alterazioni della dinamica naturale del ciclo idrologico, migliorando e potenziando le infiltrazioni in sito;0;0;0;0;0;0;0;0;0;0;0;0;0;0;1;0;0;0;0;0;0
996;Le soluzioni relative alla gestione delle acque meteoriche devono essere progettate al fine di ridurre o eliminare l’inquinamento dal deflusso delle acque meteoriche e l’eliminazione di eventuali agenti inquinanti;0;0;0;0;0;0;0;0;0;0;0;0;0;0;1;0;0;0;0;0;0
997;Le scelte progettuali, oltre ad avere efficacia sulla qualità e sostenibilità ambientale del sito e dell'edificio, devono essere uno strumento educativo e di apprendimento per gli studenti. Si tratta di un processo di coeducazione, nel quale gli elementi di conoscenza sono attivati dal vivere l’esperienza;0;1;0;0;0;0;0;0;0;0;0;0;0;0;0;0;0;0;0;0;0
998;E’ necessaria un’attività scolastica che integra obiettivi ambientali concreti, come la gestione sostenibile dell’edificio scolastico, ad obiettivi educativi, come l’apprendimento attivo;0;1;0;0;0;0;0;0;0;0;0;0;0;0;0;0;1;0;0;0;0
999;Le scelte costruttive e tecnologiche adottate devono poter essere utilizzate per integrare le lezioni diventando esempi concreti per educare gli studenti stessi alla sostenibilità;0;1;0;0;0;0;0;0;0;0;0;0;0;0;0;0;0;0;0;0;0
1000;Le soluzioni progettuali della nuova scuola infanzia devono tener conto dell’orientamento del nuovo edificio in modo tale da massimizzare gli apporto energetici gratuiti e di favorire l’integrazione impiantistica con i sistemi per la produzione di energia da fonti rinnovabili. Pertanto anche la distribuzione degli spazi interni, correlati a quelli esterni, è in funzione dell’orientamento ottimale ai fini del risparmio energetico e dell’ottimizzazione degli apporti energetici gratuiti;0;0;0;0;0;0;0;0;0;0;0;0;0;0;0;1;0;0;0;0;0
1001;L’obiettivo principale è la realizzazione di un edificio scolastico che presenti un fabbisogno energetico quasi nullo, al fine di realizzare un fabbricato a energia quasi zero con consumi ridotti e o quasi nulli;0;0;0;0;0;0;0;0;0;0;0;0;0;0;0;0;1;0;0;0;0
1002;Le scelte progettuali, pertanto, dovranno prevedere soluzioni e sistemi ad alta efficienza finalizzati al riuso delle acque meteoriche per scopi irrigui e usi non potabili;0;0;0;0;0;0;0;0;0;0;0;0;0;0;1;0;0;0;0;0;0
1003;E’ necessario controllare la qualità dell’aria interna, sia in termini igienico sanitari, che di gradevolezza;0;0;0;0;0;0;0;1;0;0;0;0;0;0;0;0;0;0;0;0;0
1004;Un’esigenza fondamentale è che l’aria non contenga agenti contaminanti sotto forma di gas, vapori, microrganismi e particolato che superino valori limite di concentrazione, né fattori nocivi come la tossicità, la radioattività;0;0;0;0;0;0;0;1;0;0;0;0;0;0;0;0;0;0;0;0;0
1005;Il tema della qualità acustica di un ambiente scolastico, in fase di costruzione di un edificio ex novo, è di primaria importanza perché concorre in modo significativo a creare le condizioni di benessere ambientale di studenti, docenti e utenti in generale;0;0;0;0;0;0;1;0;0;0;0;0;0;0;0;0;0;0;0;0;0
1006;Per la gestione della nuova Scuola, si rende necessario individuare sin dalla fase progettuale tutte le attività e i sistemi necessari ai fini di effettuare una puntuale attività di monitoraggio dei consumi energetici dell’edificio in fase di esercizio;0;0;0;0;0;0;0;0;0;0;0;0;0;0;0;0;1;0;0;0;0
1007;Si parla, pertanto, di progettazione integrata e partecipata, correlata alle nuove tecnologie;0;0;0;0;0;0;0;0;0;0;0;1;0;0;0;0;0;0;0;0;1
1008;Microambienti finalizzati ad attività diversificate per offrire funzionalità, comfort e benessere;0;0;0;0;0;0;1;0;0;0;0;0;0;0;0;0;0;0;1;0;0
1009;Ambienti che potremmo definire, mutuando un'espressione dal mondo degli ambienti on line, interoperabili e intersettoriali;0;0;0;0;0;0;0;0;0;0;0;0;0;0;0;0;0;0;1;0;0
1010;Ambienti in cui si pratica una didattica coinvolgente che non ha paura di pareti trasparenti che consentono la condivisione oltre l'aula;0;0;0;0;0;0;0;0;0;0;0;1;1;0;0;0;0;0;0;0;0
1011;L'eliminazione degli spazi di mero passaggio e l'adattabilità degli spazi cambia anche all'esterno: offrendosi alla comunità locale e al territorio la scuola si configura come civic center in grado di fungere da motore del territorio in grado di valorizzare istanze sociali, formative e culturali;1;0;0;0;0;0;0;0;0;0;0;0;0;0;0;0;0;0;1;0;0
1012;È importante costruire scuole aperte, che siano un punto di riferimento per il territorio; civic center non solo per le attività di apprendimento, ma anche per attività formative, ricreative e culturali da svilupparsi in una struttura aperta l’intera giornata;1;0;0;0;0;0;0;0;0;0;0;0;0;0;0;0;0;0;0;1;0
1013;L’idea è quella di una scuola che faccia sistema, faccia rete e che favorisca i processi di integrazione nel territorio;1;0;0;0;0;0;0;0;0;0;0;0;0;0;0;0;0;0;0;0;0
1014;È partendo da questi elementi che può emergere una nuova idea di scuola aperta, flessibile, adattabile ad un’organizzazione della didattica che mette al centro lo studente e che, allo stesso tempo, è centro culturale, di formazione, di aggregazione territoriale;1;0;0;0;0;0;0;0;0;0;0;1;0;0;0;0;0;0;1;0;0
1015;Le scuole, intese come spazi pubblici e attrezzature di interesse collettivo, hanno sempre rivestito un ruolo rilevante sotto il profilo urbano, architettonico e funzionale. Le scuole devono tornare a svolgere questo ruolo anche nei nuovi insediamenti;1;0;0;0;0;0;0;0;0;0;0;0;0;0;0;0;0;0;0;0;0
1016;Esplicitare gli aspetti di inserimento urbano ed architettonico allineamenti, materiali, composizione, ecc.; individuare le specifiche soluzioni in relazione agli spazi di mediazione tra il quartiere e la scuola;0;0;0;1;0;0;0;0;0;0;0;0;0;0;0;0;0;0;0;0;0
1017;Approfondire specificamente il tema progettuale dello spazio verde esterno, da considerare come ambito in cui sviluppare specifiche e variegate attività didattiche;0;0;0;0;0;1;0;0;0;0;0;0;1;0;0;0;0;0;0;0;0
1018;Si cercheranno soluzioni che consentano la massima permeabilità del suolo, e una più semplice manutenzione degli spazi;0;0;0;0;0;0;0;0;1;0;0;0;0;0;1;0;0;0;0;0;0
1019;Le soluzioni dovranno essere finalizzate al benessere ambientale della scuola attraverso la individuazione e la collocazione delle piantumazioni autoctone e più idonee per la protezione dai rumori esterni, per la protezione dagli aspetti climatici, per la realizzazione di specifiche zone d'ombra che consentano una migliore fruibilità di tali spazi nei mesi caldi, per favorire le attività didattiche di osservazione naturalistica;0;0;0;0;0;1;1;0;0;0;0;0;1;0;0;0;0;0;0;0;0
1020;Gli edifici scolastici, richiedono morfologie capaci di creare spazi pubblici nella zona antistante l’ingresso e spazi semipubblici all’interno;0;0;0;0;1;0;0;0;0;0;0;0;0;0;0;0;0;0;0;0;0
1021;Sebbene, occorra proteggere l’ingresso, assume anche in questo caso una certa rilevanza il rapporto degli edifici con la strada, con la ricerca di soluzioni che evitino l’eccessivo isolamento;0;0;0;1;0;0;0;0;0;0;0;0;0;0;0;0;0;0;0;0;0
1022;Si rende evidente la necessità di sottolineare il fronte su strada della facciata d’ingresso in modo da renderla un punto di riferimento per i nuovi studenti e per il quartiere in generale;0;0;0;0;0;0;0;0;0;0;0;0;0;0;0;0;0;0;0;0;0
1023;L’edificio può essere unico o a più corpi, ma deve assicurare una chiara definizione degli spazi;0;0;0;0;1;0;0;0;0;0;0;0;0;0;0;0;0;0;0;0;0
1024;Gli ambienti costruiti ed aperti dovranno permettere agli educatori di proporre ai bambini le seguenti esperienze: l'essere accolti, contenuti, coinvolti in una relazione significativa con l'educatore e con il gruppo di riferimento stabile dei compagni di sezione; consentire la possibilità di individuare piccoli gruppi, qualche amico per stare insieme, per fare qualcosa, per giocare, raccontare; consentire l’incontro e la condivisione con bambini di altri gruppi, gli altri amici;0;0;0;0;0;0;0;0;0;0;0;1;0;0;0;0;0;0;0;0;0
1025;L'enfasi sulla sorveglianza e il controllo che questa tipologia di utenti richiede deve trovare anch’essa una risposta appropriata in termini di recinti e misure di sicurezza;0;0;0;0;0;0;0;0;0;0;0;0;0;0;0;0;0;0;0;0;0
1026;Emerge l’esigenza di disporre di una struttura dalle forme semplici, funzionale, ad un solo piano con funzioni precise facilmente identificabili;0;0;0;0;1;0;0;0;0;0;0;0;0;0;0;0;0;0;0;0;0
1027;L’organismo edilizio dovrà assurgere a stilemi espressivi improntati alle tipologie tipiche del nostro centro urbano, forme pure, facilmente leggibili, volumetrie usuali non impattanti, trattamento delle facciate con metodi costruttivi e modalità espressive unanimemente condivisi;0;0;0;1;0;0;0;0;0;0;0;0;0;0;0;0;0;0;0;0;0
1028;Il rapporto con l’area a verde impone l’apertura verso l’esterno, quasi costante, degli ambienti per la didattica, questo fattore è associato alle particolari condizioni climatiche che caratterizzano il sito, ottenendo l’effetto di portare in classe l’evolversi naturale delle stagioni e dei fattori naturali correlati, implementando la dimensione spaziale con quella temporale, quale grande valore aggiunto nella crescita del bambino scolaro, che quasi naturalmente potrà apprendere vivendo sperimentalmente il trascorrere del tempo con le declinazioni delle stagioni;0;0;0;0;0;0;0;0;0;0;0;0;1;0;0;0;0;0;0;0;0
1029;Nel nostro caso la scuola deve essere accogliente, attirando le persone adulti e minori e facendole sentire a loro agio, quindi devono essere sapientemente codificati i rapporti di scala tra il bambino e gli spazi, nel senso che questi ultimi non devono essere smisurati ma richiamare il senso del domestico. Analogamente i materiali e i colori devono essere familiari e non avulsi dalla quotidianità esistenziale del bambino;0;0;0;0;0;0;1;0;0;0;0;0;0;0;0;0;0;0;0;0;0
1030;La logica distributiva dovrà essere semplice, intuitiva e di facile comprensione, le porte delle singole classi dovranno avere un colore specifico o elementi distintivi caratteristici, per una migliore riconoscibilità;0;0;0;0;1;0;0;0;0;0;0;0;0;0;0;0;0;0;0;0;0
1031;Ampie chiusure trasparenti consentiranno una comunicazione visiva con le aree esterne nel percorrere gli spazi di connessione;0;0;0;0;0;0;0;0;0;0;0;0;1;0;0;0;0;0;0;0;0
1032;Il progetto vuole dare risposta all’esigenza di stimolo delle emozioni, creando delle bucature nelle pareti divisorie intermedie, che guardano verso lo spazio connettivo di accesso alle aule; di varia forma, dimensione e disposte a diverse altezze. Attraverso questi piccoli schermi il bambino può vedere cosa succede all’esterno del proprio spazio didattico, può sorprendersi nel vedere i piedi degli amici che passano, senza vedere il resto del corpo, possono volgere il loro sguardo oltre la vetrata che delimita il corridoio, spaziando verso l’esterno;0;0;0;0;0;0;0;0;0;0;0;0;1;0;0;0;0;0;0;0;0
1033;Consentire l’attuazione di lezioni all’aperto, in spazi ben precisi, delimitati enfatizzando il senso di appartenenza, dai quali sono possibili relazioni visive con le altre unità didattiche, anch’esse in attività. Da questo punto di vista, il giardino facilmente accessibile, consente momenti didattici di grande valore, la dove, la classe, può attivare esperienze di ordine pratico finalizzate all’osservazione di fenomeni botanici naturali;0;0;0;0;0;0;0;0;0;0;0;0;1;0;0;0;0;0;0;0;0
1034;Ancor più del disegno generale della struttura architettonica, il progetto dell’arredo deve essere elaborato insieme con educatori e pedagoghi;0;0;0;0;0;0;0;0;0;0;0;1;0;0;0;0;0;0;0;0;0
1035;Le attrezzature per il gioco hanno un ruolo importante anche nell’articolare lo spazio distinguendo ambiti per diverse attività;0;0;0;0;0;0;0;0;0;0;0;1;0;0;0;0;0;0;0;0;0
1036;Con specifico riferimento agli edifici scolastici le caratteristiche e i requisiti necessari per l'eliminazione delle barriere architettoniche devono interessare non solamente le strutture interne ed esterne, ma anche l'arredamento, i sussidi e le attrezzature necessarie per assicurare lo svolgimento delle attività didattiche, che devono avere caratteristiche particolari per ogni caso di invalidità;0;0;0;0;0;0;0;0;0;0;1;0;0;0;0;0;0;0;0;0;0
1037;Alla luce del quadro normativo sopra descritto, le scelte progettuali dovranno mirare a soluzioni che garantiscano l’accessibilità, la visibilità e l’adattabilità di tutti gli spazi esterni ed interni del nuovo edificio scolastico;0;0;0;0;0;0;0;0;0;0;1;0;0;0;0;0;0;0;0;0;0
1038;Le scelte progettuali devono vertere verso soluzioni con forme poco frastagliate, poiché vi sarebbero troppe superfici disperdenti delle pareti; inoltre sarà necessario progettare volumi adeguati e non dispersivi ai fini di non aumentare i volumi da riscaldare;0;0;0;0;0;0;0;0;0;0;0;0;0;0;0;1;1;0;0;0;0
1039;Orientare l’edificio scolastico in modo tale da sfruttare al massimo gli apporti energetici gratuiti e la ventilazione naturale;0;0;0;0;0;0;0;0;0;0;0;0;0;0;0;1;0;0;0;0;0
1040;Le soluzioni progettuali devono partire dall’idea di spazio della scuola inteso come ambiente di apprendimento;0;0;0;0;0;0;0;0;0;0;0;1;0;0;0;0;0;0;0;0;0
1041;Lo spazio, pertanto, deve essere pensato e progettato per chi lo vive, in modo tale che il bambino possa sentirsi accolto, essere parte di esso e lasciare una traccia di sé;0;0;0;0;0;0;1;0;0;0;0;1;0;0;0;0;0;0;0;0;0
1042;La scuola infanzia diventa uno spazio capace di accogliere e di favorire sia momenti di interazione e condivisione con gli altri, ma anche momento di ricerca del sé e della propria intimità;0;0;0;0;0;0;0;0;0;0;0;1;0;0;0;0;0;0;1;0;0
1043;Realizzazione spazi multi dimensionali e polifunzionali;0;0;0;0;0;0;0;0;0;0;0;0;0;0;0;0;0;0;1;0;0
1044;Dotare l'area di attrezzature e di misure finalizzate all'utilizzo dei mezzi di trasporto alternativi e che limitino l’uso di veicoli occupati da singoli individui al fine di ridurre l'inquinamento da traffico automobilistico;0;0;0;0;0;0;0;0;0;1;0;0;0;0;0;0;0;0;0;0;0
1045;Adottare adeguati criteri di illuminazione per mantenere livelli di illuminazione di sicurezza;0;0;0;0;0;0;0;0;0;0;0;0;0;0;0;0;0;0;0;0;0
1046;Nelle aree occupate in modo continuativo garantire il contatto diretto degli occupanti dell’edificio con l’ambiente esterno attraverso l’illuminazione naturale degli spazi e una adeguata percezione visiva dell’esterno;0;0;0;0;0;0;1;0;0;0;0;0;0;0;0;0;0;0;0;0;0
1047;La progettazione e l’attuazione di una classe flessibile implicano la rivisitazione degli elementi fondamentali dell’organizzazione dello spazio fisico, orientato alla costruzione di un ambiente di apprendimento, basato sia sull'utilizzo di arredi funzionali agli studenti e alla didattica, sia sulla organizzazione dello spazio fisico e della struttura stessa dell'aula;0;0;0;0;0;0;0;0;0;0;0;0;0;0;0;0;0;0;1;0;0
1048;Le tecnologie digitali e gli arredi si muovono in stretta relazione con gli spazi dell’aula, che vengono modificati ogni volta in base alle esigenze didattiche e, come accade già in diversi Paesi del Nord Europa, l’unità di base non è più l’aula propriamente detta, ma l'ambiente di apprendimento che diviene polifunzionale;0;0;0;0;0;0;0;0;0;0;0;1;0;0;0;0;0;0;1;0;1
1049;Uno spazio concepito secondo una visione di connettività relazionale e multimediale, che consenta diverse modalità di attività informali da svolgere individualmente, in piccoli gruppi o in un gruppo più allargato;0;0;0;0;0;0;0;0;0;0;0;1;0;0;0;0;0;0;0;0;1
1050;Ecco quindi che la struttura esistente deve essere rivista e ridefinita in modo che corrisponda a questa funzionalità, sia nella struttura, sia negli arredi, con dotazioni flessibili e modulari, abbandonando quelle fisse e monouso;0;0;0;0;0;0;0;0;0;0;0;0;0;0;0;0;0;0;1;0;0
1051;Una conformazione di spazio maggiormente a misura di bambino, all’interno del quale lo stesso si senta il più possibile stimolato in quanto soggetto attivo della sua formazione, inserito in un clima psicologico sereno, favorevole in termini pedagogici ed efficace sul versante didattico;0;0;0;0;0;0;1;0;0;0;0;0;0;0;0;0;0;0;0;0;0
1052;Deve essere posta attenzione alla corretta insonorizzazione rispetto all'esterno e alla forma e tipologia dei materiali che devono favorire la condizione del suono senza distorsioni;0;0;0;0;0;0;1;0;0;0;0;0;0;0;0;0;0;0;0;0;0
1053;Con l’obiettivo di considerare lo spazio didattico in piena integrazione con il paese e sempre più come luogo aperto;1;0;0;0;0;0;0;0;0;0;0;0;0;0;0;0;0;0;0;1;0
1054;L'auditorium come luogo centrale e strategico per raccordare continuamente scuola famiglia territorio nella condivisione di eventi aperti e partecipati, un luogo polivalente in cui si possano realizzare anche conferenze, concerti, spettacoli;1;0;0;0;0;0;0;0;0;0;0;0;0;0;0;0;0;0;0;1;0
1055;Per questo risulta determinante operare verso l'innovazione degli spazi, la possibilità di usufruire in modo esteso delle tecnologie dell'informazione e della comunicazione, la realizzazione di ambienti flessibili, polivalenti e multilaterali, capaci di sostenere lo studio e motivare l'apprendimento, orientati alla formazione della persona, oltre che all'istruzione, sviluppando competenze di cittadinanza;0;0;0;0;0;0;0;0;0;0;0;0;0;0;0;0;0;0;1;0;1
1056;Una scuola proiettata nel terzo millennio che guarda, quindi, con attenzione allo spazio non solo come elemento fisico, ma soprattutto come luogo di crescita e di sviluppo sociale;0;0;0;0;0;0;0;0;0;0;0;1;0;0;0;0;0;0;0;0;0
1057;Per questa ragione la descrizione della scuola e dello sviluppo che si progetta individua ambienti che siano polivalenti e multilaterali;0;0;0;0;0;0;0;0;0;0;0;0;0;0;0;0;0;0;1;0;0
1058;Polivalenti, perché capaci di sostenere una didattica innovativa basata sulle nuove tecnologie attenti, alla fruizione per diversi usi e contesti, motivanti e accattivanti, flessibili e versatili, proiettati in avanti e non fissi, immobili senza futuro;0;0;0;0;0;0;0;0;0;0;0;1;0;0;0;0;0;0;1;1;0
1059;Superare una didattica orientata esclusivamente allo sviluppo di conoscenze e un modello di lezione solo frontale;0;0;0;0;0;0;0;0;0;0;0;1;0;0;0;0;0;0;0;0;0
1060;Sviluppare pienamente le potenzialità delle tecnologie digitali creando un ambiente adeguato a supportare pratiche didattiche innovative;0;0;0;0;0;0;0;0;0;0;0;1;0;0;0;0;0;0;0;0;1
1061;Creare un ambiente di apprendimento moderno e flessibile;0;0;0;0;0;0;0;0;0;0;0;0;0;0;0;0;0;0;1;0;0
1062;Gli spazi progettati dovranno risultare facilmente fruibili dagli utenti, dagli alunni e dal personale docente e non;0;0;0;0;0;0;0;0;0;0;1;0;0;0;0;0;0;0;0;0;0
1063;Essi dovranno essere concepiti secondo criteri di semplicità, razionalità dell’uso, immediata identificabilità delle funzioni e dei percorsi;0;0;0;0;1;0;0;0;0;0;0;0;0;0;0;0;0;0;0;0;0
1064;L’aula si doterà di una sorta di doppio in cui si svolgono attività complementari e profondamente diverse da quelle di classe. È quella che si definisce Aula 3.0, uno spazio che riconfigura la sua organizzazione in termini di apertura verso l’esterno, ma che trasforma anche il suo assetto in senso propriamente fisico, tramite modifiche evidenti alla disposizione degli arredi. Il tutto per favorire una didattica innovativa, che privilegia approcci laboratoriali e collaborativi;0;0;0;0;0;0;0;0;0;0;0;1;1;0;0;0;0;0;1;0;1
1065;Le nuove aule dovranno essere ispirate al concetto di Aula 3.0. Lo spazio individuato è più ampio di una classe tradizionale e inoltre dovrà essere cablato per un uso adeguato degli strumenti tecnologici necessari e per organizzare in modo flessibile gli arredi;0;0;0;0;0;0;0;0;0;0;0;0;0;0;0;0;0;0;1;0;1
